{
  "schema_version": "4.0.0",
  "pack": {
    "pack_id": "technical-blueprint",
    "version": "4.0.0",
    "display_name": "Technical Blueprint",
    "description": "Engineering architecture, workflow, and runbook slides.",
    "publisher": "MeowClaw PPT Smith",
    "license": {
      "type": "open",
      "spdx": "Apache-2.0"
    },
    "engine_compat": ">=4.0 <5",
    "compatibility_aliases": [
      "technical-blueprint"
    ]
  },
  "tokens": {
    "colors": {
      "primary": "#2A5578",
      "accent": "#3B3A34",
      "background": "#FAFAF7",
      "surface_1": "#EFEDE7",
      "surface_2": "#E7E2D7",
      "text_primary": "#2A2E35",
      "text_secondary": "#6E6A60",
      "border": "#DAD5CB",
      "positive": "#4E7358",
      "warning": "#A66A2C",
      "negative": "#9C4A48",
      "data_series": [
        "#2A5578",
        "#3B3A34",
        "#4E7358",
        "#A66A2C"
      ],
      "allowed_opacity": [
        0.08,
        0.12,
        0.18,
        0.45,
        1
      ]
    },
    "typography": {
      "font_primary": [
        "Aptos",
        "PingFang SC",
        "Noto Sans CJK SC",
        "Microsoft YaHei",
        "sans-serif"
      ],
      "title_sizes_pt": {
        "cover": 34.0,
        "section": 28.0,
        "slide": 22.0
      },
      "body_sizes_pt": {
        "large": 16.0,
        "normal": 13.0,
        "small": 10.0,
        "footnote": 8.5
      },
      "metric_sizes_pt": {
        "hero": 30.0,
        "normal": 22.0
      },
      "line_height": {
        "title": 1.1,
        "body": 1.35,
        "caption": 1.25
      },
      "font_editorial": [
        "Source Han Serif SC",
        "Noto Serif CJK SC",
        "SimSun",
        "serif"
      ],
      "font_mono": [
        "JetBrains Mono",
        "Consolas",
        "monospace"
      ],
      "weights": {
        "regular": 400,
        "medium": 500,
        "semibold": 600,
        "bold": 700
      }
    },
    "shape": {
      "card_radius_pt": 8.0,
      "border_width_pt": 0.8,
      "small_radius_pt": 4.0,
      "pill_radius_pt": 999.0,
      "emphasis_border_width_pt": 1.5,
      "divider_width_pt": 0.6,
      "connector_width_pt": 1.2
    },
    "shadow": {
      "levels": [
        {
          "blur_pt": 4.0,
          "offset_pt": 2.0,
          "opacity": 0.12
        }
      ]
    }
  },
  "skins": {
    "card": {
      "fill": "surface_1",
      "text_color": "text_primary",
      "border_color": "border",
      "variant": "tinted"
    },
    "kpi": {
      "variant": "plain",
      "value_color": "primary"
    },
    "footer": {
      "show_source": true,
      "show_page_number": true,
      "text_color": "text_secondary"
    }
  },
  "layout_knobs": {
    "density": "compact",
    "margin_scale": 0.95,
    "alignment": "left"
  }
}
